{
  "continuity_dashboard": {
    "capture_timeout_seconds": 30,
    "entrypoint": "/home/loucmane/gas-city-ops/plugins/gas-city-workflow/scripts/continuity.py",
    "freshness_sla_seconds": 180,
    "live_index": {
      "obsidian_cli": "/home/loucmane/.local/bin/obsidian",
      "probe_path": "GasCity/Continuity/Status.md",
      "timeout_seconds": 30,
      "vault": "main"
    },
    "output_dir": "/home/loucmane/vaults/main/GasCity/Continuity",
    "python": "/usr/bin/python3",
    "signing_policies": "/etc/gas-city-signing/signing-policies.json",
    "workflow_registry": "/home/loucmane/gas-city-ops/plugins/gas-city-workflow/config/projects.json"
  },
  "export_dir": "/home/loucmane/.local/state/aegis/obsidian-exports",
  "export_max_age_seconds": 600,
  "managed_output_root": "/home/loucmane/vaults/main/GasCity",
  "projects": [
    {
      "bead_export_argv": [
        "/home/loucmane/gascity/bin/gc",
        "--city",
        "/home/loucmane/gascity/city",
        "--rig",
        "gascity",
        "bd",
        "list",
        "--all",
        "--limit",
        "0",
        "--json"
      ],
      "bead_gate_paths": [
        "/home/loucmane/gascity/city/rigs/gascity/.beads.gate.lock",
        "/home/loucmane/gascity/city/.beads/dolt.gate.lock"
      ],
      "enabled": true,
      "export_timeout_seconds": 30,
      "freshness_sla_seconds": 180,
      "id": "gas-city-operations",
      "include_bead_content": false,
      "live_index": {
        "obsidian_cli": "/home/loucmane/.local/bin/obsidian",
        "probe_path": "GasCity/gas-city-operations/Aegis/Home.md",
        "timeout_seconds": 30,
        "vault": "main"
      },
      "min_interval_seconds": 10,
      "output_dir": "/home/loucmane/vaults/main/GasCity/gas-city-operations/Aegis",
      "target_dir": "/home/loucmane/gas-city-ops"
    },
    {
      "bead_export_argv": [
        "/home/loucmane/gascity/bin/gc",
        "--city",
        "/home/loucmane/gascity/city",
        "--rig",
        "gascity",
        "bd",
        "list",
        "--all",
        "--limit",
        "0",
        "--json"
      ],
      "bead_gate_paths": [
        "/home/loucmane/gascity/city/rigs/gascity/.beads.gate.lock",
        "/home/loucmane/gascity/city/.beads/dolt.gate.lock"
      ],
      "enabled": true,
      "export_timeout_seconds": 30,
      "freshness_sla_seconds": 180,
      "id": "gas-city",
      "include_bead_content": false,
      "live_index": {
        "obsidian_cli": "/home/loucmane/.local/bin/obsidian",
        "probe_path": "GasCity/gas-city/Aegis/Home.md",
        "timeout_seconds": 30,
        "vault": "main"
      },
      "min_interval_seconds": 10,
      "output_dir": "/home/loucmane/vaults/main/GasCity/gas-city/Aegis",
      "target_dir": "/home/loucmane/gascity/city/rigs/gascity"
    },
    {
      "bead_export_argv": [
        "/home/loucmane/gascity/bin/gc",
        "--city",
        "/home/loucmane/gascity/city",
        "--rig",
        "hpfetcher",
        "bd",
        "list",
        "--all",
        "--limit",
        "0",
        "--json"
      ],
      "bead_gate_paths": [
        "/home/loucmane/dev/hpfetcher-gc-main/.beads.gate.lock",
        "/home/loucmane/gascity/city/.beads/dolt.gate.lock"
      ],
      "enabled": true,
      "export_timeout_seconds": 30,
      "freshness_sla_seconds": 180,
      "id": "hpfetcher",
      "include_bead_content": false,
      "live_index": {
        "obsidian_cli": "/home/loucmane/.local/bin/obsidian",
        "probe_path": "GasCity/hpfetcher/Aegis/Home.md",
        "timeout_seconds": 30,
        "vault": "main"
      },
      "min_interval_seconds": 10,
      "output_dir": "/home/loucmane/vaults/main/GasCity/hpfetcher/Aegis",
      "target_dir": "/home/loucmane/dev/hpfetcher"
    },
    {
      "bead_export_argv": [
        "/home/loucmane/gascity/bin/gc",
        "--city",
        "/home/loucmane/gascity/city",
        "--rig",
        "blog",
        "bd",
        "list",
        "--all",
        "--limit",
        "0",
        "--json"
      ],
      "bead_gate_paths": [
        "/home/loucmane/dev/blog/.beads.gate.lock",
        "/home/loucmane/gascity/city/.beads/dolt.gate.lock"
      ],
      "enabled": true,
      "export_timeout_seconds": 30,
      "freshness_sla_seconds": 180,
      "id": "blog",
      "include_bead_content": false,
      "live_index": {
        "obsidian_cli": "/home/loucmane/.local/bin/obsidian",
        "probe_path": "GasCity/blog/Aegis/Home.md",
        "timeout_seconds": 30,
        "vault": "main"
      },
      "min_interval_seconds": 10,
      "output_dir": "/home/loucmane/vaults/main/GasCity/blog/Aegis",
      "target_dir": "/home/loucmane/dev/blog"
    },
    {
      "bead_export_argv": [
        "/home/loucmane/gascity/bin/gc",
        "--city",
        "/home/loucmane/gascity/city",
        "--rig",
        "gas-city-template",
        "bd",
        "list",
        "--all",
        "--limit",
        "0",
        "--json"
      ],
      "bead_gate_paths": [
        "/home/loucmane/gas-city-native/.beads.gate.lock",
        "/home/loucmane/gascity/city/.beads/dolt.gate.lock"
      ],
      "enabled": true,
      "export_timeout_seconds": 30,
      "freshness_sla_seconds": 180,
      "id": "gas-city-template",
      "include_bead_content": false,
      "live_index": {
        "obsidian_cli": "/home/loucmane/.local/bin/obsidian",
        "probe_path": "GasCity/gas-city-template/Aegis/Home.md",
        "timeout_seconds": 30,
        "vault": "main"
      },
      "min_interval_seconds": 10,
      "output_dir": "/home/loucmane/vaults/main/GasCity/gas-city-template/Aegis",
      "target_dir": "/home/loucmane/gas-city-template"
    },
    {
      "bead_export_argv": [
        "/home/loucmane/gascity/bin/gc",
        "--city",
        "/home/loucmane/gascity/city",
        "--rig",
        "bounty",
        "bd",
        "list",
        "--all",
        "--limit",
        "0",
        "--json"
      ],
      "bead_gate_paths": [
        "/home/loucmane/dev/bounty/.beads.gate.lock",
        "/home/loucmane/gascity/city/.beads/dolt.gate.lock"
      ],
      "enabled": true,
      "export_timeout_seconds": 30,
      "freshness_sla_seconds": 180,
      "id": "bounty",
      "include_bead_content": false,
      "live_index": {
        "obsidian_cli": "/home/loucmane/.local/bin/obsidian",
        "probe_path": "GasCity/bounty/Aegis/Home.md",
        "timeout_seconds": 30,
        "vault": "main"
      },
      "min_interval_seconds": 10,
      "output_dir": "/home/loucmane/vaults/main/GasCity/bounty/Aegis",
      "target_dir": "/home/loucmane/dev/bounty"
    },
    {
      "bead_export_argv": [
        "/home/loucmane/gascity/bin/gc",
        "--city",
        "/home/loucmane/gascity/city",
        "--rig",
        "vernissage",
        "bd",
        "list",
        "--all",
        "--limit",
        "0",
        "--json"
      ],
      "bead_gate_paths": [
        "/home/loucmane/dev/vernissage/.beads.gate.lock",
        "/home/loucmane/dev/vernissage/.beads/dolt.gate.lock"
      ],
      "enabled": true,
      "export_timeout_seconds": 30,
      "freshness_sla_seconds": 180,
      "id": "vernissage",
      "include_bead_content": false,
      "live_index": {
        "obsidian_cli": "/home/loucmane/.local/bin/obsidian",
        "probe_path": "GasCity/vernissage/Aegis/Home.md",
        "timeout_seconds": 30,
        "vault": "main"
      },
      "min_interval_seconds": 10,
      "output_dir": "/home/loucmane/vaults/main/GasCity/vernissage/Aegis",
      "target_dir": "/home/loucmane/dev/vernissage"
    },
    {
      "bead_export_argv": [
        "/home/loucmane/gascity/bin/gc",
        "--city",
        "/home/loucmane/gascity/city",
        "--rig",
        "harpoon",
        "bd",
        "list",
        "--all",
        "--limit",
        "0",
        "--json"
      ],
      "bead_gate_paths": [
        "/home/loucmane/dev/harpoon/.beads.gate.lock",
        "/home/loucmane/gascity/city/.beads/dolt.gate.lock"
      ],
      "enabled": true,
      "export_timeout_seconds": 30,
      "freshness_sla_seconds": 180,
      "id": "harpoon",
      "include_bead_content": false,
      "live_index": {
        "obsidian_cli": "/home/loucmane/.local/bin/obsidian",
        "probe_path": "GasCity/harpoon/Aegis/Home.md",
        "timeout_seconds": 30,
        "vault": "main"
      },
      "min_interval_seconds": 10,
      "output_dir": "/home/loucmane/vaults/main/GasCity/harpoon/Aegis",
      "target_dir": "/home/loucmane/dev/harpoon"
    }
  ],
  "schema_version": "1"
}
